{
  "version": 1,
  "template": "overview",
  "name": "Project overview",
  "format": "wide",
  "layout": "grid",
  "frame": "browser",
  "surface": "white",
  "density": "detailed",
  "title": "From strategy to the thing itself.",
  "intro": "A shared view of the work, the system, and what happens next.",
  "kicker": "THE IMPOSSIBLE OUTCOMES CO.",
  "footer": "STRATEGY / SYSTEMS / DESIGN / INTELLIGENCE",
  "material": "fold",
  "palette": "prism",
  "grain": 0.055,
  "seed": 0.3197,
  "rotation": -0.55,
  "scale": 17,
  "offset": 0.1,
  "size": 0.78,
  "displace": 3.4,
  "blocks": [
    {
      "type": "columns",
      "title": "Working principles",
      "items": [
        [
          "Passion",
          "Do what you want and you’ll find you’ve done what you must."
        ],
        [
          "Resolve",
          "Don’t compromise."
        ],
        [
          "Adaptability",
          "There are many ways to be right and one way to be wrong."
        ]
      ]
    },
    {
      "type": "process",
      "title": "From substance to output.",
      "items": [
        [
          "Input",
          "Gather the source."
        ],
        [
          "Frame",
          "Define the decision."
        ],
        [
          "Compose",
          "Build the artifact."
        ],
        [
          "Review",
          "Check it in context."
        ]
      ]
    },
    {
      "type": "ledger",
      "title": "Brand elements",
      "items": [
        [
          "Practice",
          "Strategy. Systems. Design. Intelligence."
        ],
        [
          "Type",
          "Poppins and Proxima Nova."
        ],
        [
          "Color",
          "Solar Ember and Blue Sky."
        ],
        [
          "Mark",
          "Exact SVG artwork."
        ]
      ]
    },
    {
      "type": "callout",
      "title": "The content sets the structure.",
      "text": "Use the material to support the argument."
    }
  ]
}
