{
  "version": 1,
  "template": "opening",
  "name": "Opening statement",
  "format": "wide",
  "layout": "split",
  "frame": "none",
  "surface": "black",
  "density": "sparse",
  "title": "Create the\nconditions.",
  "intro": "Strategy. Systems. Design. Intelligence.",
  "kicker": "THE IMPOSSIBLE OUTCOMES CO.",
  "footer": "STRATEGY / SYSTEMS / DESIGN / INTELLIGENCE",
  "material": "chrome",
  "palette": "prism",
  "grain": 0.055,
  "seed": 0.3197,
  "rotation": -0.5,
  "scale": 1,
  "offset": 0,
  "size": 0.78,
  "displace": 2.4,
  "blocks": [
    {
      "type": "material",
      "title": "Material / folded field"
    }
  ]
}
